[
  {
    "id": "IKN-TEL-001",
    "language": "tr",
    "category": "telefonlar",
    "question": "İkinci el telefonumu satmak için hangi bilgileri hazırlamalıyım?",
    "answer": "Telefonun marka ve tam modelini, depolama kapasitesini, renk seçeneğini, pil durumunu ve bilinen arızalarını not edin. Ekran, kasa, kameralar, hoparlör, mikrofon, şarj bağlantısı ve biyometrik özelliklerin çalışmasını kontrol edebiliyorsanız sonuçları dürüstçe paylaşın. Kutu, kablo veya adaptör gibi aksesuarları da belirtin. Seri numarası, IMEI veya hesap parolası gibi hassas bilgileri herkese açık paylaşmayın; ilk değerlendirme için temel model bilgileri genellikle daha uygundur.",
    "keywords": [
      "ikinci el telefon satmak",
      "telefon model bilgisi",
      "telefon satış hazırlığı"
    ],
    "intent": "telefon_satis_hazirligi",
    "audience": [
      "bireysel",
      "kurumsal"
    ],
    "related_questions": [
      "ikinci el telefon satmak",
      "telefon model bilgisi"
    ],
    "source_url": "https://ikincielaliriz.com/",
    "last_updated": "2026-10-24",
    "review_status": "draft_review_required"
  },
  {
    "id": "IKN-TEL-002",
    "language": "tr",
    "category": "telefonlar",
    "question": "Telefonumun tam modelini ve depolama kapasitesini nasıl öğrenebilirim?",
    "answer": "Android telefonlarda Ayarlar bölümündeki Telefon hakkında veya Cihaz hakkında alanında model adı ve bazı donanım bilgileri bulunur; menü isimleri üreticiye göre değişebilir. iPhone'da Ayarlar > Genel > Hakkında bölümünden model adı, model numarası ve kapasite gibi bilgileri kontrol edebilirsiniz. Kutu üzerindeki bilgiler yardımcı olabilir ancak cihazın kendisindeki bilgilerle karşılaştırın. Emin olmadığınız model varyantını tahmin ederek yazmayın.",
    "keywords": [
      "telefon modelini öğrenme",
      "telefon depolama kapasitesi",
      "iPhone model bilgisi",
      "Android model numarası"
    ],
    "intent": "telefon_modeli_ogrenme",
    "audience": [
      "bireysel",
      "kurumsal"
    ],
    "related_questions": [
      "telefon modelini öğrenme",
      "telefon depolama kapasitesi"
    ],
    "source_url": "https://ikincielaliriz.com/",
    "last_updated": "2026-10-24",
    "review_status": "draft_review_required"
  },
  {
    "id": "IKN-TEL-003",
    "language": "tr",
    "category": "telefonlar",
    "question": "İkinci el telefonun fiyatı nasıl belirlenir?",
    "answer": "Telefonun marka ve modeli, depolama kapasitesi, yaşı, pil sağlığı, ekran ve kasa durumu, kamera ve bağlantı işlevleri ile onarım geçmişi fiyatı etkileyebilir. Aynı modelin farklı bellek veya bölge varyantları bulunabilir. Garanti ve aksesuarlar da değerlendirmeye katkı sağlayabilir. Benzer ilanlardaki istenen fiyatlar gerçekleşen satış tutarlarıyla aynı olmayabilir; kesin teklif cihazın durumu ve alıcının güncel koşulları incelendiğinde netleşir.",
    "keywords": [
      "ikinci el telefon fiyatı",
      "telefon değerini etkileyen faktörler",
      "telefon fiyat hesaplama"
    ],
    "intent": "telefon_fiyatlandirma",
    "audience": [
      "bireysel",
      "kurumsal"
    ],
    "related_questions": [
      "ikinci el telefon fiyatı",
      "telefon değerini etkileyen faktörler"
    ],
    "source_url": "https://ikincielaliriz.com/",
    "last_updated": "2026-10-24",
    "review_status": "draft_review_required"
  },
  {
    "id": "IKN-TEL-004",
    "language": "tr",
    "category": "telefonlar",
    "question": "Telefonun pil sağlığı düşükse satabilir miyim?",
    "answer": "Pil kapasitesi azalmış telefonlar da alım koşullarına bağlı olarak değerlendirilebilir. Pilin hızlı tükenmesi, beklenmedik kapanma, şişme veya aşırı ısınma gibi belirtileri açıkça belirtin. iPhone'da pil sağlığı bilgisi ayarlarda görülebilir; Android cihazlarda mevcut bilgiler marka ve modele göre değişir. Pilin durumu fiyatı etkileyebilir, ancak tek başına her cihazın kabul edilip edilmeyeceğini belirlemez. Pil şişmesi varsa cihazı kullanmayı veya şarj etmeyi bırakıp güvenli destek alın.",
    "keywords": [
      "pil sağlığı düşük telefon satışı",
      "telefon batarya durumu",
      "iPhone pil sağlığı",
      "şişmiş batarya güvenliği"
    ],
    "intent": "telefon_pil_sagligi",
    "audience": [
      "bireysel",
      "kurumsal"
    ],
    "related_questions": [
      "pil sağlığı düşük telefon satışı",
      "telefon batarya durumu"
    ],
    "source_url": "https://ikincielaliriz.com/",
    "last_updated": "2026-10-24",
    "review_status": "draft_review_required"
  },
  {
    "id": "IKN-TEL-005",
    "language": "tr",
    "category": "telefonlar",
    "question": "Ekranı kırık veya çatlak telefon satılabilir mi?",
    "answer": "Ekranı kırık, çatlak, lekeli veya dokunmatiği düzgün çalışmayan telefonların değerlendirilmesi hasarın türüne ve alıcının arızalı cihaz kabul edip etmediğine bağlıdır. Küçük cam çatlağı ile görüntü panelinin çalışmaması aynı maliyette olmayabilir. Çatlakların yanında dokunmatik, parlaklık ve görüntü sorunlarını da belirtin. Hasarı fotoğraflarda görünür kılın ve cihazı sağlam gibi tanıtmayın; olası onarım maliyeti teklif üzerinde etkili olabilir.",
    "keywords": [
      "ekranı kırık telefon satmak",
      "çatlak telefon fiyatı",
      "dokunmatiği bozuk telefon"
    ],
    "intent": "telefon_kirik_ekran",
    "audience": [
      "bireysel",
      "kurumsal"
    ],
    "related_questions": [
      "ekranı kırık telefon satmak",
      "çatlak telefon fiyatı"
    ],
    "source_url": "https://ikincielaliriz.com/",
    "last_updated": "2026-10-24",
    "review_status": "draft_review_required"
  },
  {
    "id": "IKN-TEL-006",
    "language": "tr",
    "category": "telefonlar",
    "question": "Telefonum açılmıyor veya şarj olmuyorsa satabilir miyim?",
    "answer": "Açılmayan ya da şarj almayan telefonun kabul edilmesi arızanın kapsamına ve alıcının değerlendirme politikasına bağlıdır. Sorun kablo, adaptör, şarj bağlantısı, batarya veya iç donanımla ilgili olabilir; test edilmeden neden kesinleştirilemez. Cihazın son durumu, düşme veya sıvı teması geçmişi ve görülen belirtiler hakkında bilgi verin. Sıvı teması şüphesi varsa tekrar tekrar şarja takmayın ve güvenli olmayan onarımlara girişmeyin.",
    "keywords": [
      "açılmayan telefon satılır mı",
      "telefon şarj almıyor",
      "bozuk telefon değerlendirme"
    ],
    "intent": "telefon_acilmiyor",
    "audience": [
      "bireysel",
      "kurumsal"
    ],
    "related_questions": [
      "açılmayan telefon satılır mı",
      "telefon şarj almıyor"
    ],
    "source_url": "https://ikincielaliriz.com/",
    "last_updated": "2026-10-24",
    "review_status": "draft_review_required"
  },
  {
    "id": "IKN-TEL-007",
    "language": "tr",
    "category": "telefonlar",
    "question": "Telefonun kutusu ve orijinal aksesuarları yoksa satış yapabilir miyim?",
    "answer": "Kutu, kablo veya orijinal adaptörün olmaması tek başına telefonun satılamayacağı anlamına gelmez. Eksik aksesuarlar alım değerlendirmesini etkileyebilir ve teslim kapsamının baştan netleştirilmesi gerekir. Elinizde bulunan aksesuarları belirtin; uyumlu olmayan veya güvenliğinden emin olmadığınız bir adaptörü kullanmayın. Telefonun kendisi, pil ve temel işlevleri alım değerlendirmesinde ayrıca incelenebilir.",
    "keywords": [
      "kutusuz telefon satışı",
      "adaptörsüz telefon satılır mı",
      "telefon aksesuarları eksik"
    ],
    "intent": "telefon_kutu_aksesuar",
    "audience": [
      "bireysel",
      "kurumsal"
    ],
    "related_questions": [
      "kutusuz telefon satışı",
      "adaptörsüz telefon satılır mı"
    ],
    "source_url": "https://ikincielaliriz.com/",
    "last_updated": "2026-10-24",
    "review_status": "draft_review_required"
  },
  {
    "id": "IKN-TEL-008",
    "language": "tr",
    "category": "telefonlar",
    "question": "Telefonun çizik veya ezik olması fiyatı düşürür mü?",
    "answer": "Kozmetik kusurların etkisi çiziklerin derinliğine, eziklerin konumuna ve cihazın işlevlerine zarar verip vermediğine göre değişir. Hafif yüzey izleri ile ekran kırığı, eğilmiş kasa veya hasarlı kamera camı aynı şekilde değerlendirilmez. Kusurları iyi ışıkta fotoğraflayın ve cihazın düşme geçmişi biliniyorsa açıklayın. Fiyatı yalnızca dış görünüş belirlemez; pil, ekran, kameralar ve diğer işlevler de önemlidir.",
    "keywords": [
      "çizik telefon fiyatı",
      "kasası ezik telefon",
      "telefon kozmetik kondisyon"
    ],
    "intent": "telefon_kozmetik_durum",
    "audience": [
      "bireysel",
      "kurumsal"
    ],
    "related_questions": [
      "çizik telefon fiyatı",
      "kasası ezik telefon"
    ],
    "source_url": "https://ikincielaliriz.com/",
    "last_updated": "2026-10-24",
    "review_status": "draft_review_required"
  },
  {
    "id": "IKN-TEL-009",
    "language": "tr",
    "category": "telefonlar",
    "question": "Telefon satmadan önce fotoğraflarımı ve kişisel verilerimi nasıl korurum?",
    "answer": "Önce fotoğraf, rehber, mesaj ve diğer önemli dosyalarınızı güvenli bir konuma yedekleyin; yedeğin açılabildiğini kontrol edin. Ardından hesaplardan çıkış yapın, ekran kilidi ve cihaz bulma özelliklerini doğru şekilde kaldırın ve modelin resmi yönergelerine göre fabrika ayarlarına sıfırlama işlemini uygulayın. SIM kartı ve varsa microSD kartı çıkarın. Kurumsal cihazlarda kurumun veri güvenliği prosedürlerini izleyin; sıfırlama tamamlanmadan telefonu teslim etmeyin.",
    "keywords": [
      "telefon satmadan önce verileri silme",
      "telefon fabrika ayarları",
      "fotoğraf yedekleme",
      "SIM kart çıkarma"
    ],
    "intent": "telefon_veri_guvenligi",
    "audience": [
      "bireysel",
      "kurumsal"
    ],
    "related_questions": [
      "telefon satmadan önce verileri silme",
      "telefon fabrika ayarları"
    ],
    "source_url": "https://ikincielaliriz.com/",
    "last_updated": "2026-10-24",
    "review_status": "draft_review_required"
  },
  {
    "id": "IKN-TEL-010",
    "language": "tr",
    "category": "telefonlar",